Nombre,Categoría,Declaración de seguridad,Clasificación 1,Clasificación 2,Clasificación 3
fenobarbital,D,"Consulte los textos relevantes en la Información del Producto de cada antiepiléptico para obtener más información sobre su idoneidad para el uso durante el embarazo. El tratamiento con fenobarbital en mujeres embarazadas con epilepsia presenta un riesgo para el feto en términos de defectos congénitos mayores y menores, incluyendo defectos craneofaciales y cardíacos congénitos, anomalías digitales y, con menos frecuencia, labio y paladar hendido. La hemorragia al nacer y la adicción también son un riesgo. Se recomienda el tratamiento profiláctico con vitamina K1 para la madre antes del parto (así como para el neonato) y se debe monitorear al neonato para detectar signos de sangrado. También se han reportado efectos adversos sobre el desarrollo neuroconductual. Los estudios que investigaron los efectos del fenobarbital administrado prenatalmente sobre el desarrollo neurológico fueron en su mayoría pequeños en número; sin embargo, se encontraron efectos negativos significativos sobre el desarrollo neurológico y el coeficiente intelectual después de la exposición intrauterina y posnatal. Se recomienda que: • las mujeres que toman medicamentos antiepilépticos (FAE) reciban asesoramiento pregestacional con respecto al riesgo de malformaciones congénitas y resultados adversos del desarrollo; • Los AED deben continuarse durante el embarazo con la dosis efectiva más baja y debe considerarse la monoterapia si es apropiado; • La suplementación adecuada de ácido fólico debe discutirse como parte del asesoramiento previo al embarazo y durante el embarazo; • Se debe considerar el diagnóstico prenatal especializado, incluida una ecografía detallada a mitad del trimestre.",Sistema nervioso central,Anticonvulsivos/antiepilépticos,
fenobarbital (fenobarbital),D,"Consulte los textos relevantes en la Información del Producto de cada antiepiléptico para obtener más información sobre su idoneidad para el uso durante el embarazo. El tratamiento con fenobarbital en mujeres embarazadas con epilepsia presenta un riesgo para el feto en términos de defectos congénitos mayores y menores, incluyendo defectos craneofaciales y cardíacos congénitos, anomalías digitales y, con menos frecuencia, labio y paladar hendido. La hemorragia al nacer y la adicción también son un riesgo. Se recomienda el tratamiento profiláctico con vitamina K1 para la madre antes del parto (así como para el neonato) y se debe monitorear al neonato para detectar signos de sangrado. También se han reportado efectos adversos sobre el desarrollo neuroconductual. Los estudios que investigaron los efectos del fenobarbital administrado prenatalmente sobre el desarrollo neurológico fueron en su mayoría pequeños en número; sin embargo, se encontraron efectos negativos significativos sobre el desarrollo neurológico y el coeficiente intelectual después de la exposición intrauterina y posnatal. Se recomienda que: • las mujeres que toman medicamentos antiepilépticos (FAE) reciban asesoramiento pregestacional con respecto al riesgo de malformaciones congénitas y resultados adversos del desarrollo; • Los AED deben continuarse durante el embarazo con la dosis efectiva más baja y debe considerarse la monoterapia si es apropiado; • La suplementación adecuada de ácido fólico debe discutirse como parte del asesoramiento previo al embarazo y durante el embarazo; • Se debe considerar el diagnóstico prenatal especializado, incluida una ecografía detallada a mitad del trimestre.",Sistema nervioso central,Anticonvulsivos/antiepilépticos,
fenolftaleína,B2,,Sistema alimentario,Laxantes,
fenoperidina,do,Los analgésicos opioides pueden causar depresión respiratoria en recién nacidos. Se han reportado síntomas de abstinencia en recién nacidos con el uso prolongado de este tipo de fármacos.,Sistema nervioso central,Analgésicos y antipiréticos (ver también agentes antiinflamatorios no esteroides),analgésicos opioides
fenoxibenzamina,B2,Se sabe que este medicamento es mutagénico y cancerígeno en roedores.,Sistema cardiovascular,Vasodilatadores,
fenoximetilpenicilina,A,,Antimicrobianos,Antibióticos,penicilinas
fensuximida,D,"En comparación con los anticonvulsivos convencionales, se desconoce el alcance del riesgo de este fármaco.",Sistema nervioso central,Anticonvulsivos/antiepilépticos,
fentermina,B2,No se recomienda la reducción de peso con medicamentos supresores del apetito durante el embarazo.,Metabolismo,Agentes anoréxicos y reductores de peso,
fentolamina,B1,,Sistema cardiovascular,Vasodilatadores,
fenilbutazona,do,"Los antiinflamatorios no esteroideos (AINE) inhiben la síntesis de prostaglandinas, lo que puede afectar negativamente al embarazo. Consulte los textos pertinentes en la información del producto de cada AINE para obtener información sobre su idoneidad para su uso durante el embarazo. Estudios epidemiológicos sugieren un mayor riesgo de aborto espontáneo tras el uso de inhibidores de la síntesis de prostaglandinas al inicio del embarazo. Su administración durante la última etapa del embarazo puede causar el cierre del conducto arterioso fetal, oligohidramnios, insuficiencia renal fetal, inhibición de la agregación plaquetaria y retraso del parto. El tratamiento continuo con AINE durante el último trimestre del embarazo solo debe administrarse bajo indicación médica válida. Durante los últimos días previos al parto, deben evitarse los agentes con efecto inhibidor sobre la síntesis de prostaglandinas.",Sistema musculoesquelético,Medicamentos antiinflamatorios no esteroides (AINE),
fenilefrina,B2,,Sistema cardiovascular,estimulantes adrenérgicos,
fenilefrina,B2,,Sistema respiratorio,Descongestionantes,
fenilpropanolamina,B2,,Sistema cardiovascular,estimulantes adrenérgicos,
fenilpropanolamina,B2,,Sistema respiratorio,Descongestionantes,
fenitoína sódica,D,"Consulte los textos relevantes en la Información del Producto de cada antiepiléptico para obtener más información sobre su idoneidad para su uso durante el embarazo. La exposición prenatal a la fenitoína puede aumentar el riesgo de malformaciones congénitas y otros resultados adversos del desarrollo. Se han notificado malformaciones como hendiduras orofaciales, defectos cardíacos, rasgos faciales dismórficos, hipoplasia de uñas y dedos y anomalías del crecimiento (incluida la microcefalia), ya sea de forma individual o como parte de un síndrome de hidantoína fetal, en niños nacidos de mujeres con epilepsia que tomaron fenitoína durante el embarazo. Se han notificado trastornos del neurodesarrollo en niños nacidos de mujeres con epilepsia que utilizaron fenitoína sola o en combinación con otros FAE durante el embarazo. Se han notificado varios casos de neoplasias malignas, incluido el neuroblastoma, en niños cuyas madres recibieron fenitoína durante el embarazo. Se han notificado trastornos del neurodesarrollo en niños nacidos de mujeres con epilepsia que utilizaron fenitoína sola o en combinación con otros antiepilépticos durante el embarazo. La fenitoína puede causar defectos de coagulación con el consiguiente riesgo de hemorragia en el feto y el recién nacido, que puede prevenirse mediante la administración profiláctica de vitamina K a la madre antes del parto. Se recomienda que: • Las mujeres que toman medicamentos antiepilépticos (FAE) reciban asesoramiento pregestacional con respecto al riesgo de malformaciones congénitas o resultados adversos del desarrollo; • Los FAE deben continuarse durante el embarazo a la dosis efectiva más baja, y debe usarse monoterapia si corresponde, ya que el riesgo de malformaciones congénitas o resultados adversos del desarrollo es mayor en mujeres que toman medicación combinada; • Se debe discutir la suplementación adecuada de ácido fólico como parte del asesoramiento pregestacional y durante el embarazo; • Se debe considerar el diagnóstico prenatal especializado, incluida una ecografía detallada a mediados del trimestre.",Sistema nervioso central,Anticonvulsivos/antiepilépticos,
folcodina,A,,Sistema respiratorio,Antitusivos,
fisostigmina,do,,Sistema musculoesquelético,relajantes musculares,
pilocarpina,B3,,Medicamentos oftálmicos,,
pimecrolimus,B3,,Medicamentos utilizados en Dermatología,Actual,
pimozida,do,"Los neonatos expuestos a antipsicóticos durante el tercer trimestre del embarazo corren el riesgo de experimentar trastornos neurológicos extrapiramidales o síntomas de abstinencia tras el parto. Se han notificado casos de agitación, hipertonía, hipotonía, temblor, somnolencia, dificultad respiratoria y trastornos de la alimentación en estos neonatos.",Sistema nervioso central,fármacos antipsicóticos,
pindolol,do, Los agentes bloqueantes beta-adrenérgicos pueden causar efectos farmacológicos como bradicardia en el feto y el recién nacido.,Sistema cardiovascular,Agentes bloqueantes beta-adrenérgicos,
pioglitazona,B3,,Sistema endocrino,agentes hipoglucemiantes,
pipecuronio,do,No se han demostrado efectos adversos en el feto ni en el recién nacido.,Medicamentos utilizados en anestesia,Agentes bloqueadores neuromusculares,
piperacilina,B1,,Antimicrobianos,Antibióticos,penicilinas
piperacilina con tazobactam,B1,,Antimicrobianos,Antibióticos,penicilinas
sulfato de piperazina estrona (estropipato),B1,,Sistema endocrino,Estrógenos (ver también anticonceptivos orales),
butóxido de piperonilo,B3,,Medicamentos utilizados en Dermatología,antiparasitarios tópicos,
pirfenidona,B3,,Sistema respiratorio,,
piroxicam,do,"Los antiinflamatorios no esteroideos (AINE) inhiben la síntesis de prostaglandinas, lo que puede afectar negativamente al embarazo. Consulte los textos pertinentes en la información del producto de cada AINE para obtener información sobre su idoneidad para su uso durante el embarazo. Estudios epidemiológicos sugieren un mayor riesgo de aborto espontáneo tras el uso de inhibidores de la síntesis de prostaglandinas al inicio del embarazo. Su administración durante la última etapa del embarazo puede causar el cierre del conducto arterioso fetal, oligohidramnios, insuficiencia renal fetal, inhibición de la agregación plaquetaria y retraso del parto. El tratamiento continuo con AINE durante el último trimestre del embarazo solo debe administrarse bajo indicación médica válida. Durante los últimos días previos al parto, deben evitarse los agentes con efecto inhibidor sobre la síntesis de prostaglandinas.",Sistema musculoesquelético,Medicamentos antiinflamatorios no esteroides (AINE),
pitavastatina,D," El colesterol y otros productos de la vía de biosíntesis del colesterol son componentes esenciales para el desarrollo fetal, incluyendo la síntesis de esteroides y membranas celulares. Debido a la capacidad de los inhibidores de la HMG-CoA reductasa para disminuir la síntesis...",Sistema cardiovascular,Agentes hipolipidémicos,
pizotifeno,B1,,Sistema cardiovascular,Preparaciones antimigrañosas,
 plerixafor,D,Este medicamento ha sido teratogénico en animales.,Sangre y sistema hematopoyético, Agentes hematopoyéticos,
plitidepsina,D,Este medicamento es letal para el embrión en animales preñados.,Agentes antineoplásicos,,
"vacuna antineumocócica, polisacáridos capsulares",B2,,Vacunas,Vacunas de subunidades,Vacunas conjugadas de polisacáridos
vacuna antineumocócica conjugada de polisacáridos,B1,,Vacunas,Vacunas de subunidades,Vacunas conjugadas de polisacáridos
podofilotoxina,D,,Medicamentos utilizados en Dermatología,Actual,Agente antimitótico
polatuzumab vedotina,D,"Según su mecanismo de acción y los hallazgos en animales, polatuzumab vedotin puede causar daño fetal. Se observó letalidad embriofetal y toxicidad en ratas con exposiciones inferiores a las esperadas en pacientes que recibieron polatuzumab vedotin. Los hallazgos en animales incluyeron un aumento en la incidencia de pérdida posimplantación y un aumento en la incidencia de malformaciones fetales, como protrusión lingual, malrotación de las extremidades posteriores, gastrosquisis y agnatia. Se debe recomendar a las mujeres en edad fértil que utilicen métodos anticonceptivos eficaces durante el tratamiento y durante al menos 9 meses después de la última dosis.",Agentes antineoplásicos,,
vacuna contra la poliomielitis (inyección),B2,,Vacunas,Vacunas inactivadas,
vacuna contra la poliomielitis (oral),A,"Las vacunas de virus vivos disponibles actualmente no han causado efectos teratogénicos en humanos. Para obtener información más completa, consulte la publicación de ATAGI, «The Australian Immunisation Handbook».",Vacunas,Vacunas vivas atenuadas,
pomalidomida,incógnita,Este medicamento puede causar daño fetal en humanos. No debe administrarse a mujeres embarazadas ni a mujeres en edad fértil que no utilicen métodos anticonceptivos eficaces durante el tratamiento con este medicamento ni durante un período posterior. Debe descartarse el embarazo antes de iniciar el tratamiento con este medicamento.,Alergia y sistema inmunológico,Inmunomodificadores,
ponatinib (como hidrocloruro),D,"Este medicamento es embriotóxico, teratogénico y causó embrioletalidad en animales preñados.",Agentes antineoplásicos,Inhibidores de la tirosina quinasa,
ponesimod,D,"Basándose en su mecanismo de acción y en datos obtenidos en animales (en ratas y conejas preñadas, ponesimod indujo letalidad embriofetal y teratogenicidad cuando se administró durante el período de organogénesis), ponesimod puede causar daño fetal cuando se administra a una mujer embarazada.",Alergia y sistema inmunológico,Inmunomodificadores,
 posaconazol,B3,,Antimicrobianos,Agentes antimicóticos (ver también antimicóticos tópicos),
toxina prabotulinum A,B3,,Sistema musculoesquelético,relajantes musculares,
pralatrexato,D,"Los agentes citotóxicos pueden producir aborto espontáneo, pérdida fetal y defectos de nacimiento.",Agentes antineoplásicos,Antimetabolitos,
pralsetinib,D, El medicamento pralsetinib es teratogénico y causó embrioletalidad en animales preñados.,Agentes antineoplásicos,Inhibidores de la tirosina quinasa,
pramipexol,B3,,Sistema nervioso central,Agentes antiparkinsonianos,
prasterona,D,,Sistema genitourinario,,
prasugrel,B1,Todos los anticoagulantes y agentes trombolíticos pueden producir hemorragia placentaria y posterior prematuridad y pérdida fetal.,Sistema cardiovascular,Anticoagulantes y agentes trombolíticos,
pravastatina,D,"El colesterol y otros productos de la biosíntesis del colesterol son componentes esenciales para el desarrollo fetal, incluyendo la síntesis de esteroides y membranas celulares. Debido a la capacidad de los inhibidores de la HMG-CoA reductasa para disminuir la síntesis de colesterol y posiblemente otros productos de la biosíntesis del colesterol, estos fármacos pueden causar daño fetal si se administran a una mujer embarazada. La hiperlipidemia fisiológica del embarazo no requiere tratamiento.",Sistema cardiovascular,Agentes hipolipidémicos,
praziquantel,B1,,Antimicrobianos,Antihelmínticos,
prazosina,B2,,Sistema cardiovascular,Antihipertensivos,
prednisolona,A,,Sistema endocrino,Corticosteroides,Sistémico
prednisona,A,,Sistema endocrino,Corticosteroides,Sistémico
pregabalina,D,"Los datos de un estudio observacional nórdico de más de 2700 embarazos expuestos a pregabalina en el primer trimestre mostraron una mayor prevalencia de malformaciones congénitas mayores (MCM) entre la población pediátrica (vivos o nacidos muertos) expuesta a pregabalina en comparación con la población no expuesta (5,9% frente a 4,1%). El riesgo de MCM entre la población pediátrica expuesta a pregabalina en el primer trimestre fue ligeramente mayor en comparación con la población no expuesta. Los análisis de malformaciones específicas mostraron mayores riesgos de malformaciones del sistema nervioso, el ojo, hendiduras orofaciales, malformaciones urinarias y malformaciones genitales, pero las cifras fueron pequeñas y las estimaciones imprecisas. No se debe utilizar pregabalina durante el embarazo a menos que sea claramente necesario (si el beneficio para la madre supera claramente el riesgo potencial para el feto).",Sistema nervioso central,Anticonvulsivos/antiepilépticos,
prilocaína (con o sin felipresina),A,,Medicamentos utilizados en anestesia,Anestésicos locales,
fosfato de primaquina,D,"Evite su uso en el tercer trimestre, ya que la primaquina puede causar hemólisis neonatal y metahemoglobinemia. El uso de este fármaco en el tratamiento de la malaria se acepta porque el pequeño riesgo para el feto se ve compensado por los beneficios para la madre y el feto. La profilaxis en situaciones de alto riesgo también está justificada.",Antimicrobianos,Antipalúdicos,
primidona,D,"Consulte los textos relevantes en la Información del producto de antiepilépticos individuales para obtener más información sobre la idoneidad para su uso en el embarazo. La terapia con primidona en mujeres embarazadas con epilepsia presenta un riesgo para el feto debido a los defectos congénitos mayores y menores, incluyendo defectos craneofaciales y cardíacos congénitos, anomalías digitales y, con menos frecuencia, labio y paladar hendido asociados con los metabolitos de fenobarbital producidos a partir de la primidona. La hemorragia al nacer y la adicción también son un riesgo. Se recomienda el tratamiento profiláctico con vitamina K1 para la madre antes del parto (así como para el neonato) y el neonato debe ser monitoreado para detectar signos de sangrado. Se recomienda que: • Las mujeres que toman medicamentos antiepilépticos (AED) reciban asesoramiento previo al embarazo con respecto al riesgo de malformaciones congénitas y resultados adversos del desarrollo; • Los AED deben continuarse durante el embarazo a la dosis efectiva más baja y debe usarse monoterapia si corresponde; • Se debe analizar la suplementación adecuada de ácido fólico como parte del asesoramiento previo al embarazo y durante el embarazo; • Se debe considerar el diagnóstico prenatal especializado, incluida una ecografía detallada a mitad del trimestre.",Sistema nervioso central,Anticonvulsivos/antiepilépticos,
probenecid,B2,,Sistema musculoesquelético,Agentes utilizados en la gota y la hiperuricemia,
probucol,B1,,Sistema cardiovascular,Agentes hipolipidémicos,
procainamida,B2,,Sistema cardiovascular,Antiarrítmicos,
bencilpenicilina procaína,A,,Antimicrobianos,Antibióticos,penicilinas
clorhidrato de procaína,B2,,Medicamentos utilizados en anestesia,Anestésicos locales,
penicilina procaína (bencilpenicilina procaína),A,,Antimicrobianos,Antibióticos,penicilinas
procarbazina,D,"Los agentes citotóxicos pueden producir abortos espontáneos, pérdida fetal y defectos de nacimiento.",Agentes antineoplásicos,,
proclorperazina,do,"Cuando se administran en dosis altas al final del embarazo, las fenotiazinas han provocado trastornos neurológicos prolongados en el bebé.",Sistema nervioso central,"Antieméticos, antinauseosos",fenotiazinas
prociclidina,A,,Sistema nervioso central,Agentes antiparkinsonianos,
progesterona,A,,Sistema endocrino,Progestágenos (ver también anticonceptivos orales),
anticonceptivos que solo usan progestágeno,B3,La evidencia acumulada indica que la exposición inadvertida a estos agentes durante el embarazo temprano no se ha asociado con un mayor riesgo de defectos de nacimiento.,Agentes anticonceptivos,Anticonceptivos orales,
proguanil,B2,"Si se administra durante el embarazo, se debe administrar un suplemento de ácido fólico. El proguanil se ha utilizado ampliamente sin efectos adversos en el embarazo. El uso de este fármaco en el tratamiento de la malaria se acepta porque el pequeño riesgo para el feto se ve compensado por los beneficios para la madre y el feto. La profilaxis en situaciones de alto riesgo también está justificada.",Antimicrobianos,Antipalúdicos,
promazina,do,"Cuando se administran en dosis altas al final del embarazo, las fenotiazinas han provocado trastornos neurológicos prolongados en el recién nacido.",Sistema nervioso central,fármacos antipsicóticos,fenotiazinas
prometazina,do,"Cuando se administran en dosis altas al final del embarazo, las fenotiazinas han provocado trastornos neurológicos prolongados en el bebé.",Alergia y sistema inmunológico,Antihistamínicos,
prometazina,do,"Cuando se administran en dosis altas al final del embarazo, las fenotiazinas han provocado trastornos neurológicos prolongados en el bebé.",Sistema nervioso central,"Antieméticos, antinauseosos",fenotiazinas
propantelina,B2,,Sistema alimentario,Antiespasmódicos,
propantelina,B2,,Agentes colinérgicos y anticolinérgicos,,
propofol,do,"Todos los anestésicos generales pueden producir depresión del sistema nervioso central y respiratoria en el recién nacido. En la práctica habitual, esto no parece ser un problema. Sin embargo, en el feto con problemas de salud, se debe considerar cuidadosamente esta posible depresión y la selección de fármacos, dosis y técnicas anestésicas específicas.",Medicamentos utilizados en anestesia,Anestésicos generales,
propranolol,do, Los agentes bloqueantes beta-adrenérgicos pueden causar efectos farmacológicos como bradicardia en el feto y el recién nacido.,Sistema cardiovascular,Agentes bloqueantes beta-adrenérgicos,
propiltiouracilo,D, Los agentes antitiroideos pueden causar bocio congénito al inhibir la síntesis de tiroxina en el feto.,Sistema endocrino,agentes antitiroideos,
protamina,B2,,Sistema cardiovascular,Agentes hemostáticos,
proteína c (humana),B2,,Sistema cardiovascular,Agentes hemostáticos,
protriptilina,do,Se han reportado síntomas de abstinencia en recién nacidos con el uso materno prolongado de antidepresivos tricíclicos.,Sistema nervioso central,antidepresivos,antidepresivos tricíclicos
proxymetacaína,B2,,Medicamentos oftálmicos,,
prucaloprida,B1,,Sistema alimentario,Laxantes,
pseudoefedrina,B2,,Sistema cardiovascular,estimulantes adrenérgicos,
pseudoefedrina,B2,,Sistema respiratorio,Descongestionantes,
embonato de pirantel,B2,,Antimicrobianos,Antihelmínticos,
pirazinamida,B2,,Antimicrobianos,Antituberculosos y antilepróticos,
piretrinas,B2,,Medicamentos utilizados en Dermatología,antiparasitarios tópicos,
piridostigmina,do,El requerimiento materno de este fármaco en el contexto de la miastenia gravis puede ser absoluto. Los efectos colinérgicos en el neonato son poco frecuentes.,Medicamentos utilizados en la miastenia grave,,
pirimetamina,B3,"Este medicamento puede interferir con el metabolismo del ácido fólico, y experimentos con animales han demostrado que la administración de dosis muy altas de pirimetamina durante el desarrollo de órganos puede provocar defectos congénitos típicos del antagonismo del ácido fólico. Si se administra pirimetamina durante el embarazo, se debe administrar un suplemento de ácido fólico. El uso de este medicamento en el tratamiento de la malaria se acepta porque el pequeño riesgo para el feto se ve compensado por los beneficios para la madre y el feto. La profilaxis en situaciones de alto riesgo también está justificada.",Antimicrobianos,Antipalúdicos,
vacuna contra la fiebre Q,B2,,Vacunas,Vacunas inactivadas,
quetiapina,do,"Los neonatos expuestos a antipsicóticos durante el tercer trimestre del embarazo corren el riesgo de experimentar trastornos neurológicos extrapiramidales o síntomas de abstinencia tras el parto. Se han notificado casos de agitación, hipertonía, hipotonía, temblor, somnolencia, dificultad respiratoria y trastornos de la alimentación en estos neonatos.",Sistema nervioso central,fármacos antipsicóticos,
quinagolida,B3,,Sistema endocrino,Inhibidores de la hipófisis,
quinapril,D,"Cuando se toman durante el segundo y tercer trimestre, los inhibidores de la ECA causan diversas anomalías, como disfunción renal y oligohidramnios. Estas pueden estar asociadas con la muerte fetal intrauterina. Si bien no se han relacionado efectos adversos fetales con el uso de inhibidores de la ECA durante el primer trimestre, el número de exposiciones reportadas es demasiado pequeño para determinar de forma concluyente su seguridad durante dicho período. Las mujeres embarazadas que toman inhibidores de la ECA deben cambiar su medicación antihipertensiva lo antes posible para mantener la presión arterial normal. En general, se recomienda no usar inhibidores de la ECA para el tratamiento de la hipertensión en mujeres con probabilidad de embarazo.",Sistema cardiovascular,Antihipertensivos,Inhibidores de la enzima convertidora de angiotensina (ECA)
quinetazona,do,"Las tiazidas, los diuréticos relacionados y los diuréticos de asa pueden causar alteraciones electrolíticas en el feto. Se ha reportado trombocitopenia neonatal con el uso de tiazidas y diuréticos relacionados. Los diuréticos de asa, como la furosemida y la bumetanida, probablemente también estén asociados con este riesgo. Durante la última etapa del embarazo, este tipo de productos solo debe administrarse bajo indicación médica y en la dosis mínima eficaz.",Sistema cardiovascular,Diuréticos,"Tiazidas, diuréticos relacionados y diuréticos de asa"
quinidina,do,"Este fármaco es estructuralmente similar a la quinina, que, en dosis altas, ha demostrado causar daño fetal. Se ha utilizado para tratar la arritmia cardíaca fetal.",Sistema cardiovascular,Antiarrítmicos,
quinina,D,"En dosis estándar, la quinina no se ha asociado con daño fetal. En dosis tóxicas, causa daño fetal, incluyendo sordera. Su capacidad para inducir contracciones uterinas también constituye un riesgo de aborto.",Sistema musculoesquelético,relajantes musculares,
