Nombre,Categoría,Declaración de seguridad,Clasificación 1,Clasificación 2,Clasificación 3
abacavir,B3,,Antimicrobianos,agentes antivirales,
abacavir / dolutegravir / lamivudina,B3,,Antimicrobianos,agentes antivirales,
abacavir / lamivudina / zidovudina,B3,,Antimicrobianos,agentes antivirales,
abacavir/lamivudina,B3,,Antimicrobianos,agentes antivirales,
abatacept,do,,Alergia y sistema inmunológico,Inmunomodificadores,
abciximab,do,Todos los anticoagulantes y agentes trombolíticos pueden producir hemorragia placentaria y posterior prematuridad y pérdida fetal.,Sistema cardiovascular,Anticoagulantes y agentes trombolíticos,
abemaciclib,D," Según los resultados de estudios realizados en animales y su mecanismo de acción, abemaciclib puede dañar al feto.",Agentes antineoplásicos,,
abiraterona,D,Los antiandrógenos tienen el potencial de provocar la feminización del feto masculino a las 8 semanas o más de la concepción y se debe evitar la exposición durante el embarazo.,Sistema endocrino,Antiandrógenos,
acalabrutinib,do,"Según hallazgos en animales, acalabrutinib puede causar daño fetal.",Agentes antineoplásicos,Inhibidores de la tirosina quinasa,
acamprosato,B2,," Agentes desintoxicantes, antídotos",,
acarbosa,B3,,Sistema endocrino,agentes hipoglucemiantes,
acetazolamida,B3,,Sistema cardiovascular,Diuréticos,inhibidor de la anhidrasa carbónica
acetazolamida (oftálmica),B3,,Medicamentos oftálmicos,,
acetilcolina,B2,,Medicamentos oftálmicos,,
acetilcisteína,B2,,Sistema respiratorio,,
acetilcisteína (inhalada),B2,,Sistema respiratorio,Expectorantes y mucolíticos,
acetilcisteína (intravenosa),B2,," Agentes desintoxicantes, antídotos",,
aciclovir,B3,,Antimicrobianos,agentes antivirales,
aciclovir (tópico),B3,,Medicamentos utilizados en Dermatología,antiviral tópico,
acitretina,incógnita,"Este medicamento es teratogénico en dosis dentro del rango terapéutico. Se almacena en el organismo durante varios meses después de suspenderlo. Debido a su larga vida media y a su almacenamiento en la grasa, se recomienda a las pacientes no concebir hasta dos años después de suspender el tratamiento debido al riesgo de malformaciones congénitas. Si se produce un embarazo durante el tratamiento con este medicamento, existe un alto riesgo de malformaciones congénitas.",Medicamentos utilizados en Dermatología,Sistémico,
bromuro de aclidinio,B3,,Sistema respiratorio,Agentes inhalatorios,Relajantes del broncoespasmo
bromuro de aclidinio/fumarato de eformoterol,B3,,Sistema respiratorio,Agentes inhalatorios,
actinomicina D (dactinomicina),D,"Los agentes citotóxicos pueden producir abortos espontáneos, pérdida fetal y defectos de nacimiento.",Agentes antineoplásicos,Agentes citotóxicos antibióticos,
adalimumab,do,"El adalimumab atraviesa la barrera placentaria. Debido a su inhibición del TNF-alfa, la administración de adalimumab durante el embarazo podría afectar la respuesta inmunitaria del recién nacido y del lactante expuestos intrauterinamente.",Alergia y sistema inmunológico,Inmunomodificadores,
adapaleno,D,"Se han reportado casos aislados de defectos congénitos en bebés nacidos de mujeres que usan este medicamento. Debido al riesgo potencial de efectos adversos en el desarrollo fetal, adapaleno no debe ser usado por mujeres embarazadas o que planeen quedar embarazadas durante el tratamiento.",Medicamentos utilizados en Dermatología,Actual,
adefovir,B3,,Antimicrobianos,agentes antivirales,
adenosina,B2,,Sistema cardiovascular,Antiarrítmicos,
adrenalina (epinefrina),A,,Sistema cardiovascular,estimulantes adrenérgicos,
afamelanotida,B1,,Medicamentos utilizados en dermatología,Sistémico,
afatinib,do,Este fármaco inhibe el EGFR. El EGFR desempeña un papel importante en el desarrollo embriofetal.,Agentes antineoplásicos,Inhibidores de la tirosina quinasa,
aflibercept,D,,Medicamentos oftálmicos,,
agalsidasa alfa,B2,,Metabolismo,Agentes utilizados para el tratamiento de trastornos metabólicos,
agalsidasa beta,B2,,Metabolismo,Agentes utilizados para el tratamiento de trastornos metabólicos,
agomelatina,B1,,Sistema nervioso central,antidepresivos,
alatrofloxacina,B3,,Antimicrobianos,Antibióticos,Quinolonas
albendazol,D,"En estudios con animales, el albendazol es teratogénico en varias especies. Hasta que se disponga de datos en humanos, debe sospecharse su teratogénesis.",Antimicrobianos,Antihelmínticos,
albutrepenonacog alfa,B2,,Sistema cardiovascular,Agentes hemostáticos,
alcuronio,B2,,Medicamentos utilizados en anestesia,Agentes bloqueadores neuromusculares,
aldesleucina,do,"Los agentes citotóxicos pueden producir abortos espontáneos, pérdida fetal y defectos de nacimiento.",Agentes antineoplásicos,,
alectinib,D," Alectinib causó letalidad embriofetal en ratas y conejos, anomalías viscerales y esqueléticas en ratas, y malformaciones viscerales y variaciones esqueléticas en conejos.",Agentes antineoplásicos,Inhibidores de la tirosina quinasa,
alefacept,do,,Alergia y sistema inmunológico,Inmunomodificadores,
alemtuzumab,B2,,Agentes antineoplásicos,anticuerpos monoclonales,
alendronato,B3,,Sistema endocrino,Agentes que afectan el metabolismo del calcio y los huesos,Bifosfonatos
alfentanilo,do,Los analgésicos opioides pueden causar depresión respiratoria en recién nacidos. Se han reportado síntomas de abstinencia en recién nacidos con el uso prolongado de este tipo de fármacos.,Sistema nervioso central,Analgésicos y antipiréticos (ver también agentes antiinflamatorios no esteroides),analgésicos opioides
alfuzosina,B2,,Sistema genitourinario,Hiperplasia de próstata,
alginatos/antiácidos,A,,Sistema alimentario,"Hiperacidez, reflujo, úlceras",
alglucerasa,B3,,Metabolismo,Agentes utilizados para el tratamiento de trastornos metabólicos,
alglucosidasa alfa,B1,,Metabolismo,Agentes utilizados para el tratamiento de trastornos metabólicos,
alimemazina,do,"Cuando se administran en dosis altas al final del embarazo, las fenotiazinas han provocado trastornos neurológicos prolongados en el bebé.",Alergia y sistema inmunológico,Antihistamínicos,
alirocumab,B1,,Sistema cardiovascular,Agentes hipolipidémicos,
aliskiren,D,"Cuando se usan durante el segundo y tercer trimestre del embarazo, los medicamentos que actúan directamente sobre el sistema renina-angiotensina pueden causar lesiones e incluso la muerte del feto en desarrollo. Si bien no se han relacionado efectos adversos fetales con el uso de ARA en el primer trimestre, el número de exposiciones reportadas es demasiado pequeño para determinar de forma concluyente su seguridad durante el primer trimestre. Las mujeres embarazadas que toman ARA deben cambiar su medicación antihipertensiva lo antes posible para mantener la presión arterial normal. En general, se recomienda no usar ARA para el manejo de la hipertensión en mujeres con probabilidad de embarazo.",Sistema cardiovascular,Antihipertensivos,Antagonistas del receptor de angiotensina II e inhibidores de la renina
extracto de polen alergénico de 5 gramíneas,B2,,Alergia y sistema inmunológico,,
alopurinol,B2,,Sistema musculoesquelético,Agentes utilizados en la gota y la hiperuricemia,
alogliptina/metformina,do,Es importante lograr una normoglucemia estricta durante el embarazo.,Sistema endocrino,agentes hipoglucemiantes,
benzoato de alogliptina,B3,,Sistema endocrino,agentes hipoglucemiantes,
alpelisib,D," Según datos en animales y su mecanismo de acción, alpelisib puede causar daño fetal cuando se administra a una mujer embarazada.",Agentes antineoplásicos,,
inhibidor de la alfa-1-proteinasa,B2,,Sistema respiratorio,,
alprazolam,do,"Las benzodiazepinas pueden causar hipotonía, depresión respiratoria e hipotermia en el recién nacido si se administran en dosis altas durante el parto. Se han reportado síntomas de abstinencia en recién nacidos con el uso prolongado de esta clase de fármacos.",Sistema nervioso central,Benzodiazepinas,
alprenolol,do, Los agentes bloqueantes beta-adrenérgicos pueden causar efectos farmacológicos como bradicardia en el feto y el recién nacido.,Sistema cardiovascular,Agentes bloqueantes beta-adrenérgicos,
alteplasa,B1,,Sistema cardiovascular,agentes fibrinolíticos,
altretamina (hexametilmelamina),D,"Los agentes citotóxicos pueden producir abortos espontáneos, pérdida fetal y defectos de nacimiento.",Agentes antineoplásicos,,
amantadina,B3,,Sistema nervioso central,Agentes antiparkinsonianos,
cloruro de ambenonio,B2,,Medicamentos utilizados en la miastenia grave,,
ambrisentán,incógnita,"La teratogenicidad es un efecto de clase de estos agentes, que induce múltiples anomalías fetales en estudios con animales. Es probable que estos fármacos causen defectos congénitos importantes si se utilizan durante el embarazo.",Sistema cardiovascular,Antagonista del receptor de endotelina,
ametocaína (tetracaína),B2,,Medicamentos oftálmicos,,
amifampridina,do,"No se han realizado estudios en animales para evaluar los posibles efectos adversos de la amifampridina en el desarrollo embriofetal. Sin embargo, la amifampridina puede bloquear los canales de potasio, que también contribuyen a la función normal del músculo liso uterino durante la gestación y el parto.",Sistema nervioso central,,
amifostina,B3,,Agentes antineoplásicos,Terapia de apoyo no citotóxica,
amikacina,D,"Existe evidencia de una captación selectiva de aminoglucósidos por el riñón fetal, lo que resulta en daño (probablemente reversible) a las nefronas inmaduras. También se ha reportado daño al octavo par craneal tras la exposición intrauterina a algunos aminoglucósidos. Debido a su similitud química, todos los aminoglucósidos deben considerarse potencialmente nefrotóxicos y ototóxicos para el feto. Cabe destacar que las concentraciones sanguíneas terapéuticas en la madre no implican seguridad para el feto.",Antimicrobianos,Antibióticos,Aminoglucósidos
amilorida,do,Los diuréticos ahorradores de potasio pueden provocar un trastorno electrolítico en el feto.,Sistema cardiovascular,Diuréticos,diuréticos ahorradores de potasio
ácido aminocaproico,B3,,Sistema cardiovascular,Agentes hemostáticos,
aminoglutetimida,D,Se han reportado casos de pseudohermafrodismo con el uso de este medicamento durante el embarazo.,Agentes antineoplásicos,Agentes antineoplásicos hormonales,
aminoglutetimida,D,Se han reportado casos de pseudohermafrodismo con el uso de este medicamento durante el embarazo.,Sistema endocrino,Agentes hormonales,
ácido aminolevulínico HCl,do,,Agentes de diagnóstico,,
amiodarona,do,"Debido a la larga vida media de la amiodarona y su principal metabolito, y a su potencial para causar función tiroidea anormal y bradicardia en el feto, probablemente sea mejor evitar su uso durante los tres meses previos al embarazo y durante todo el mismo. Cuando la exposición del feto sea inevitable, se debe evaluar la función tiroidea (incluida la TSH) del recién nacido con prontitud.",Sistema cardiovascular,Antiarrítmicos,
amisulprida,do,"Se han reportado casos de agitación, hipertonía, hipotonía, temblor, somnolencia, dificultad respiratoria y trastornos de la alimentación en estos neonatos. La gravedad de estas complicaciones ha variado. Si bien en algunos casos los síntomas han remitido espontáneamente, en otros los neonatos han requerido apoyo en la unidad de cuidados intensivos y hospitalización prolongada. La amisulprida solo debe usarse durante el embarazo si el beneficio potencial justifica el riesgo potencial para el feto.",Sistema nervioso central,fármacos antipsicóticos,
amitriptilina,do,Se han reportado síntomas de abstinencia en recién nacidos con el uso materno prolongado de antidepresivos tricíclicos.,Sistema nervioso central,antidepresivos,antidepresivos tricíclicos
amivantamab,D," Se sabe que la IgG1 atraviesa la placenta. Por lo tanto, el amivantamab podría transmitirse de una paciente embarazada al feto en desarrollo. La administración de otras moléculas inhibidoras del EGFR o MET a animales gestantes ha provocado un aumento en la incidencia de deterioro del desarrollo embriofetal, embrioletalidad y aborto.",Agentes antineoplásicos,anticuerpos monoclonales,
amlodipino,do, Los bloqueadores de los canales de calcio tienen el potencial de producir hipoxia fetal asociada con hipotensión materna.,Sistema cardiovascular,Antihipertensivos,bloqueadores de los canales de calcio
amlodipino/atorvastatina,D,"Los bloqueadores de los canales de calcio pueden producir hipoxia fetal asociada a la hipotensión materna. El colesterol y otros productos de la biosíntesis del colesterol son componentes esenciales para el desarrollo fetal, incluyendo la síntesis de esteroides y membranas celulares. Debido a la capacidad de los inhibidores de la HMG-CoA reductasa para disminuir la síntesis de colesterol y posiblemente otros productos de la biosíntesis del colesterol, estos fármacos pueden causar daño fetal si se administran a una mujer embarazada. La hiperlipidemia fisiológica del embarazo no requiere tratamiento.",Sistema cardiovascular,,
amlodipino/hidroclorotiazida/valsartán,D,"Los bloqueadores de los canales de calcio pueden producir hipoxia fetal asociada a la hipotensión materna. Cuando se utilizan durante el segundo y tercer trimestre del embarazo, los fármacos que actúan directamente sobre el sistema renina-angiotensina pueden causar lesiones e incluso la muerte del feto en desarrollo. Si bien no se han relacionado efectos adversos fetales con el uso de ARA en el primer trimestre, el número de exposiciones reportadas es demasiado pequeño para determinar de forma concluyente su seguridad durante dicho período. Las mujeres embarazadas que toman ARA deben cambiar su medicación antihipertensiva lo antes posible para mantener la presión arterial normal. En general, se recomienda no utilizar ARA para el tratamiento de la hipertensión en mujeres con probabilidad de embarazo. Las tiazidas, los diuréticos relacionados y los diuréticos de asa pueden causar alteraciones electrolíticas en el feto. Se ha reportado trombocitopenia neonatal con el uso de tiazidas y diuréticos relacionados. Los diuréticos de asa, como la furosemida y la bumetanida, probablemente también estén asociados a este riesgo. Durante la última parte del embarazo, los productos de este tipo sólo deben administrarse bajo indicaciones sólidas y en la dosis efectiva más baja.",Sistema cardiovascular,,
amlodipino/olmesartán medoxomilo,D,"Los bloqueadores de los canales de calcio pueden producir hipoxia fetal asociada a la hipotensión materna. Cuando se utilizan durante el segundo y tercer trimestre del embarazo, los fármacos que actúan directamente sobre el sistema renina-angiotensina pueden causar lesiones e incluso la muerte del feto en desarrollo. Si bien no se han relacionado efectos adversos fetales con el uso de ARA en el primer trimestre, el número de exposiciones reportadas es demasiado pequeño para determinar de forma concluyente su seguridad durante dicho período. Las mujeres embarazadas que toman ARA deben cambiar su medicación antihipertensiva lo antes posible para mantener la presión arterial normal. En general, se recomienda no utilizar ARA para el tratamiento de la hipertensión en mujeres con probabilidad de embarazo.",Sistema cardiovascular,Antihipertensivos,
amlodipino/olmesartán medoxomilo/hidroclorotiazida,D,"Los bloqueadores de los canales de calcio pueden producir hipoxia fetal asociada a la hipotensión materna. Cuando se utilizan durante el segundo y tercer trimestre del embarazo, los fármacos que actúan directamente sobre el sistema renina-angiotensina pueden causar lesiones e incluso la muerte del feto en desarrollo. Si bien no se han relacionado efectos adversos fetales con el uso de ARA en el primer trimestre, el número de exposiciones reportadas es demasiado pequeño para determinar de forma concluyente su seguridad durante dicho período. Las mujeres embarazadas que toman ARA deben cambiar su medicación antihipertensiva lo antes posible para mantener la presión arterial normal. En general, se recomienda no utilizar ARA para el tratamiento de la hipertensión en mujeres con probabilidad de embarazo. Las tiazidas, los diuréticos relacionados y los diuréticos de asa pueden causar alteraciones electrolíticas en el feto. Se ha reportado trombocitopenia neonatal con el uso de tiazidas y diuréticos relacionados. Los diuréticos de asa, como la furosemida y la bumetanida, probablemente también estén asociados a este riesgo. Durante la última parte del embarazo, los productos de este tipo sólo deben administrarse bajo indicaciones sólidas y en la dosis efectiva más baja.",Sistema cardiovascular,,
amlodipino/telmisartán,D,"Los bloqueadores de los canales de calcio pueden producir hipoxia fetal asociada a la hipotensión materna. Cuando se utilizan durante el segundo y tercer trimestre del embarazo, los fármacos que actúan directamente sobre el sistema renina-angiotensina pueden causar lesiones e incluso la muerte del feto en desarrollo. Si bien no se han relacionado efectos adversos fetales con el uso de ARA en el primer trimestre, el número de exposiciones reportadas es demasiado pequeño para determinar de forma concluyente su seguridad durante dicho período. Las mujeres embarazadas que toman ARA deben cambiar su medicación antihipertensiva lo antes posible para mantener la presión arterial normal. En general, se recomienda no utilizar ARA para el tratamiento de la hipertensión en mujeres con probabilidad de embarazo.",Sistema cardiovascular,Antihipertensivos,
amlodipino/valsartán,D,"Los bloqueadores de los canales de calcio pueden producir hipoxia fetal asociada a la hipotensión materna. Cuando se utilizan durante el segundo y tercer trimestre del embarazo, los fármacos que actúan directamente sobre el sistema renina-angiotensina pueden causar lesiones e incluso la muerte del feto en desarrollo. Si bien no se han relacionado efectos adversos fetales con el uso de ARA en el primer trimestre, el número de exposiciones reportadas es demasiado pequeño para determinar de forma concluyente su seguridad durante dicho período. Las mujeres embarazadas que toman ARA deben cambiar su medicación antihipertensiva lo antes posible para mantener la presión arterial normal. En general, se recomienda no utilizar ARA para el tratamiento de la hipertensión en mujeres con probabilidad de embarazo.",Sistema cardiovascular,Antihipertensivos,
cloruro amónico,A,,Sistema respiratorio,Expectorantes y mucolíticos,
amobarbital,do,"Los barbitúricos pueden causar hipotensión, depresión respiratoria e hipotermia en el recién nacido. Debe evitarse el tratamiento continuo durante el embarazo y su administración durante el parto.",Sistema nervioso central,Hipnóticos y sedantes,Barbitúricos
amorolfina,B3,,Medicamentos utilizados en Dermatología,"Antifúngicos tópicos, antisépticos (ver también agentes antifúngicos)",
amoxicilina,A,,Antimicrobianos,Antibióticos,penicilinas
anfotericina,B3,,Antimicrobianos,Agentes antimicóticos (ver también antimicóticos tópicos),
 anfotericina B (liposomal),B3,,Antimicrobianos,Agentes antimicóticos (ver también antimicóticos tópicos),
ampicilina,A,,Antimicrobianos,Antibióticos,penicilinas
amprenavir,B3,,Antimicrobianos,agentes antivirales,
amsacrina,D,"Los agentes citotóxicos pueden producir abortos espontáneos, pérdida fetal y defectos de nacimiento.",Agentes antineoplásicos,,
amilobarbital (amobarbital),do,"Los barbitúricos pueden causar hipotensión, depresión respiratoria e hipotermia en el recién nacido. Debe evitarse el tratamiento continuo durante el embarazo y su administración durante el parto.",Sistema nervioso central,Hipnóticos y sedantes,Barbitúricos
anagrelida,B3,,Agentes antineoplásicos,,
Anakinra,B1,,Alergia y sistema inmunológico,Inmunomodificadores,
anastrozol,do,Este medicamento altera el metabolismo dependiente de estrógenos y puede provocar aborto.,Agentes antineoplásicos,Agentes antineoplásicos hormonales,
ancestros,B2,,Sangre y sistema hematopoyético,Agentes hematopoyéticos,
andexanet alfa,B2,,"Agentes desintoxicantes, antídotos",,
anecortave,B1,,Medicamentos oftálmicos,,
anidulafungina,B3,,Antimicrobianos,Agentes antimicóticos (ver también antimicóticos tópicos),
anifrolumab,do,"En teoría, podría existir un mayor riesgo de ciertas infecciones virales en los bebés (humanos) expuestos a anifrolumab durante la última etapa del período gestacional.",Alergia y sistema inmunológico,Inmunomodificadores,
anistreplasa,do,,Sistema cardiovascular,agentes fibrinolíticos,
antitrombina III,do,,Sistema cardiovascular,Agentes hemostáticos,
inmunoglobulina antitimocítica,do,,Alergia y sistema inmunológico,Inmunomodificadores,
apalutamida,D,Por su mecanismo de acción puede producir daño fetal si se administra durante el embarazo.,Agentes antineoplásicos,Agentes antineoplásicos hormonales,
apixabán,do,Todos los anticoagulantes y agentes trombolíticos pueden producir hemorragia placentaria y posterior prematuridad y pérdida fetal.,Sistema cardiovascular,Anticoagulantes y agentes trombolíticos,
apomorfina,B3,,Sistema nervioso central,Agentes antiparkinsonianos,
apraclonidina,B3,,Medicamentos oftálmicos,,
apremilast,B3,,Alergia y sistema inmunológico,Inmunomodificadores,
aprepitant,B1,,Agentes antineoplásicos,Terapia de apoyo no citotóxica,
aprotinina,B1,,Sistema cardiovascular,Agentes hemostáticos,
argipresina,B2,,Sistema endocrino,Antidiuréticos,
aripiprazol,do,"Se han reportado casos de agitación, hipertonía, hipotonía, temblor, somnolencia, dificultad respiratoria y trastornos de la alimentación en estos neonatos. La gravedad de estas complicaciones ha variado. Si bien en algunos casos los síntomas han remitido espontáneamente, en otros los neonatos han requerido apoyo en la unidad de cuidados intensivos y hospitalización prolongada. El aripiprazol solo debe usarse durante el embarazo si el beneficio potencial justifica el riesgo potencial para el feto.",Sistema nervioso central,fármacos antipsicóticos,
armodafinilo,D,Este medicamento es embriotóxico y fetotóxico cuando se administra a ratas y conejas preñadas.,Sistema nervioso central,estimulantes del sistema nervioso central,
trióxido de arsénico,incógnita,"En hámsteres, ratas y ratones, la administración parenteral de arsenito durante la organogénesis produjo malformaciones fetales, incluyendo defectos del tubo neural, oculares, faciales, genitourinarios y esqueléticos. El tratamiento con arsenito en ratones durante la gestación también ha producido una respuesta tumorígena generalizada en las crías.",Agentes antineoplásicos,,
artemeter con lumefantina,D," Se sabe que las artemisininas son embriotóxicas en animales, causando malformaciones cardiovasculares y esqueléticas. Según estudios en animales, se sospecha que el artemeter causa graves defectos congénitos cuando se administra durante el primer trimestre del embarazo.",Antimicrobianos,Antipalúdicos,
articaína,B3,,Medicamentos utilizados en anestesia,Anestésicos locales,
articaína / adrenalina,B3,,Medicamentos utilizados en anestesia,Anestésicos locales,
clorhidrato de asciminib,D,"El asciminib puede causar daño fetal si se administra a mujeres embarazadas. En ratas y conejas preñadas tratadas, la administración de asciminib durante la organogénesis indujo embriotoxicidad, fetotoxicidad y teratogenicidad.",Agentes antineoplásicos,Inhibidores de la tirosina quinasa,
asenapina,do,"Se han reportado casos de agitación, hipertonía, hipotonía, temblor, somnolencia, dificultad respiratoria y trastornos de la alimentación en estos neonatos. La gravedad de estas complicaciones ha variado. Si bien en algunos casos los síntomas han remitido espontáneamente, en otros los neonatos han requerido apoyo en la unidad de cuidados intensivos y hospitalización prolongada. Asenapina solo debe usarse durante el embarazo si el beneficio potencial justifica el riesgo potencial para el feto.",Sistema nervioso central,fármacos antipsicóticos,
asfotasa alfa (rch),do,Existe un efecto potencial sobre el desarrollo óseo embriofetal y neonatal con la producción de anticuerpos contra la asfotasa alfa.,Metabolismo,Agentes utilizados para el tratamiento de trastornos metabólicos,
asparaginasa,D,"La citotoxicidad de la actividad de la asparaginasa supone un riesgo de aborto espontáneo, pérdida fetal y defectos de nacimiento.",Agentes antineoplásicos,Antimetabolitos,
aspirina,do,"La aspirina inhibe la síntesis de prostaglandinas. Administrada al final del embarazo, puede causar el cierre prematuro del conducto arterioso fetal y retrasar el parto. La aspirina aumenta el tiempo de sangrado tanto en el recién nacido como en la madre debido a sus efectos antiplaquetarios. Se deben evitar los productos que contienen aspirina durante el último trimestre. La aspirina en dosis bajas (100 mg/día) no afecta el tiempo de sangrado.",Sistema nervioso central,Analgésicos y antipiréticos (ver también agentes antiinflamatorios no esteroides),
aspirina / dipiridamol,do,"La aspirina inhibe la síntesis de prostaglandinas. Administrada al final del embarazo, puede causar el cierre prematuro del conducto arterioso fetal y retrasar el parto. La aspirina aumenta el tiempo de sangrado tanto en el recién nacido como en la madre debido a sus efectos antiplaquetarios. Se deben evitar los productos que contienen aspirina durante el último trimestre. La aspirina en dosis bajas (100 mg/día) no afecta el tiempo de sangrado.",Sistema cardiovascular,Vasodilatadores,
asunaprevir,B1,,Antimicrobianos,agentes antivirales,
atazanavir,B2,,Antimicrobianos,agentes antivirales,
atazanavir/cobicistat,B2,,Antimicrobianos,agentes antivirales,
